{
  "id": "55555555-5555-4555-8555-555555555555",
  "organization_id": "22222222-2222-4222-8222-222222222222",
  "run_id": "11111111-1111-4111-8111-111111111111",
  "parent_step_id": null,
  "seq": 1,
  "name": "bootstrap",
  "kind": "manual",
  "agent_id": null,
  "status": "queued",
  "input": { "note": "phase-11" },
  "output": null,
  "created_at": "2026-07-18T12:00:00.000Z",
  "updated_at": "2026-07-18T12:00:00.000Z"
}
